{"$schema":"http://json-schema.org/draft-07/schema#","$id":"stegverse_memory_use_receipt.schema.json","title":"StegVerse Memory Use Receipt v1","type":"object","required":["schema","timestamp","vault_id","actor","decision","receipt_hash"],"properties":{"schema":{"type":"string","const":"stegverse_memory_use_receipt.v1"},"timestamp":{"type":"string"},"vault_id":{"type":"string"},"packet_id":{"type":"string"},"actor":{"type":"string"},"target_entity":{"type":"string"},"target_stage":{"type":"string"},"purpose":{"type":"string"},"decision":{"type":"string"},"basis":{"type":"string"},"files_used":{"type":"array","items":{"type":"string"}},"allowed_use":{"type":"array","items":{"type":"string"}},"forbidden_use":{"type":"array","items":{"type":"string"}},"stop_condition":{"type":"string"},"receipt_hash":{"type":"string"},"previous_receipt_hash":{"type":"string"}}}
